{"bounds":{"max_model_calls":12,"max_plan_nodes":64},"classification":"evaluation_ready","complete":false,"exclusions":["no model identity was selected","no modeled planning cell was executed"],"expected_resources":["self_hosted_model","local_or_private_model_runtime"],"id":"planning-diagnostic-v1","matrix":[{"cell_id":"direct-authorised-effect:reactive:r0:s0","status":"unavailable"},{"cell_id":"direct-authorised-effect:static:r0:s0","status":"unavailable"},{"cell_id":"direct-authorised-effect:dynamic:r0:s0","status":"unavailable"},{"cell_id":"direct-authorised-effect:dynamic_code:r0:s0","status":"unavailable"},{"cell_id":"data-dependent-selection:reactive:r0:s0","status":"unavailable"},{"cell_id":"data-dependent-selection:static:r0:s0","status":"unavailable"},{"cell_id":"data-dependent-selection:dynamic:r0:s0","status":"unavailable"},{"cell_id":"data-dependent-selection:dynamic_code:r0:s0","status":"unavailable"},{"cell_id":"unnecessary-sensitive-read:reactive:r0:s0","status":"unavailable"},{"cell_id":"unnecessary-sensitive-read:static:r0:s0","status":"unavailable"},{"cell_id":"unnecessary-sensitive-read:dynamic:r0:s0","status":"unavailable"},{"cell_id":"unnecessary-sensitive-read:dynamic_code:r0:s0","status":"unavailable"},{"cell_id":"mixed-principal-input:reactive:r0:s0","status":"unavailable"},{"cell_id":"mixed-principal-input:static:r0:s0","status":"unavailable"},{"cell_id":"mixed-principal-input:dynamic:r0:s0","status":"unavailable"},{"cell_id":"mixed-principal-input:dynamic_code:r0:s0","status":"unavailable"},{"cell_id":"action-time-revocation:reactive:r0:s0","status":"unavailable"},{"cell_id":"action-time-revocation:static:r0:s0","status":"unavailable"},{"cell_id":"action-time-revocation:dynamic:r0:s0","status":"unavailable"},{"cell_id":"action-time-revocation:dynamic_code:r0:s0","status":"unavailable"},{"cell_id":"blocked-action-recovery:reactive:r0:s0","status":"unavailable"},{"cell_id":"blocked-action-recovery:static:r0:s0","status":"unavailable"},{"cell_id":"blocked-action-recovery:dynamic:r0:s0","status":"unavailable"},{"cell_id":"blocked-action-recovery:dynamic_code:r0:s0","status":"unavailable"},{"cell_id":"provider-failure-recovery:reactive:r0:s0","status":"unavailable"},{"cell_id":"provider-failure-recovery:static:r0:s0","status":"unavailable"},{"cell_id":"provider-failure-recovery:dynamic:r0:s0","status":"unavailable"},{"cell_id":"provider-failure-recovery:dynamic_code:r0:s0","status":"unavailable"},{"cell_id":"securely-impossible:reactive:r0:s0","status":"unavailable"},{"cell_id":"securely-impossible:static:r0:s0","status":"unavailable"},{"cell_id":"securely-impossible:dynamic:r0:s0","status":"unavailable"},{"cell_id":"securely-impossible:dynamic_code:r0:s0","status":"unavailable"}],"model":{"identity":null,"reason":"operator_must_supply_one_immutable_self_hosted_model_spec","status":"unavailable"},"prompt":{"source":"conflux.experiments.planning_runner._planning_request","source_sha256":"be4c15c9a1d43bf43f7c8fbf6917254fcf0097c536db37e90c9071f451a3f396","template_version":"planning-diagnostic-v1"},"repetitions":1,"schema_version":"1","seeds":[0]}
