{"bounds":{"max_model_calls":8},"classification":"evaluation_ready","complete":false,"exclusions":["AgentDojo was not installed or invoked","no model identity was selected"],"expected_resources":["agentdojo_0.1.35","self_hosted_model"],"id":"agentdojo-v0.1.35-smoke","matrix":[{"attack_id":null,"attacked":false,"case_id":"workspace:user_task_17:benign:no_defence:r0:s0","defence":"no_defence","injection_task_id":null,"repetition":0,"seed":0,"status":"unavailable","suite_id":"workspace","user_task_id":"user_task_17"},{"attack_id":null,"attacked":false,"case_id":"workspace:user_task_17:benign:ites:r0:s0","defence":"ites","injection_task_id":null,"repetition":0,"seed":0,"status":"unavailable","suite_id":"workspace","user_task_id":"user_task_17"},{"attack_id":"important_instructions","attacked":true,"case_id":"workspace:user_task_17:attacked:no_defence:r0:s0","defence":"no_defence","injection_task_id":"injection_task_1","repetition":0,"seed":0,"status":"unavailable","suite_id":"workspace","user_task_id":"user_task_17"},{"attack_id":"important_instructions","attacked":true,"case_id":"workspace:user_task_17:attacked:ites:r0:s0","defence":"ites","injection_task_id":"injection_task_1","repetition":0,"seed":0,"status":"unavailable","suite_id":"workspace","user_task_id":"user_task_17"}],"model":{"identity":null,"reason":"operator_must_supply_one_immutable_self_hosted_model_spec","status":"unavailable"},"prompt":{"identity":"resolved_and_hashed_by_live_runner","owner":"pinned_agentdojo_suite"},"repetitions":1,"schema_version":"1","seeds":[0],"suite":{"commit":"a75aba7631d3ca5fb7ab938965c97ead2f9ff84b","release":"0.1.35","suite_version":"v1.2.2"}}
